{"$schema":"https://json-schema.org/draft/2020-12/schema","type":"object","additionalProperties":false,"required":["schema_version","inputs","outcomes","transitions","metrics","observations","digest"],"properties":{"schema_version":{"const":1},"digest":{"$ref":"#/$defs/digest"},"inputs":{"type":"array","minItems":1,"uniqueItems":true,"items":{"$ref":"#/$defs/input"}},"outcomes":{"type":"array","minItems":1,"uniqueItems":true,"items":{"$ref":"#/$defs/outcome"}},"transitions":{"type":"array","minItems":1,"uniqueItems":true,"items":{"$ref":"#/$defs/transition"}},"metrics":{"type":"object","additionalProperties":false,"required":["automation","classification","manual_effort","provenance","invariants","generated_files","replay_restarts","report_usability","fresh_vs_incremental"],"properties":{"automation":{"$ref":"#/$defs/automation"},"classification":{"$ref":"#/$defs/classification"},"manual_effort":{"$ref":"#/$defs/manual_effort"},"provenance":{"$ref":"#/$defs/provenance"},"invariants":{"$ref":"#/$defs/invariants"},"generated_files":{"$ref":"#/$defs/generated_files"},"replay_restarts":{"$ref":"#/$defs/replay_restarts"},"report_usability":{"$ref":"#/$defs/report_usability"},"fresh_vs_incremental":{"$ref":"#/$defs/fresh_vs_incremental"}}},"observations":{"type":"array","minItems":9,"uniqueItems":true,"items":{"$ref":"#/$defs/observation"}}},"$defs":{"digest":{"type":"string","pattern":"^sha256:[0-9a-f]{64}$"},"input":{"type":"object","additionalProperties":false,"required":["role","digest"],"properties":{"role":{"type":"string","minLength":1},"digest":{"$ref":"#/$defs/digest"}}},"outcome":{"type":"object","additionalProperties":false,"required":["path","forecast","actual"],"properties":{"path":{"type":"string","minLength":1},"forecast":{"type":"string","minLength":1},"actual":{"type":"string","minLength":1}}},"paths":{"type":"array","uniqueItems":true,"items":{"type":"string","minLength":1}},"transition":{"type":"object","additionalProperties":false,"required":["forecast","actual","paths"],"properties":{"forecast":{"type":"string","minLength":1},"actual":{"type":"string","minLength":1},"paths":{"$ref":"#/$defs/paths"}}},"count":{"type":"integer","minimum":0},"automation":{"type":"object","additionalProperties":false,"required":["total_outcomes","automatic_outcomes","basis_points"],"properties":{"total_outcomes":{"$ref":"#/$defs/count"},"automatic_outcomes":{"$ref":"#/$defs/count"},"basis_points":{"$ref":"#/$defs/count"}}},"classification":{"type":"object","additionalProperties":false,"required":["false_clean_paths","false_conflict_paths"],"properties":{"false_clean_paths":{"$ref":"#/$defs/paths"},"false_conflict_paths":{"$ref":"#/$defs/paths"}}},"manual_effort":{"type":"object","additionalProperties":false,"required":["manual_outcomes","forecast_manual_outcomes","eliminated_manual_boundaries"],"properties":{"manual_outcomes":{"$ref":"#/$defs/count"},"forecast_manual_outcomes":{"$ref":"#/$defs/count"},"eliminated_manual_boundaries":{"$ref":"#/$defs/count"}}},"provenance":{"type":"object","additionalProperties":false,"required":["locked_inputs","stale_or_missing_records"],"properties":{"locked_inputs":{"$ref":"#/$defs/count"},"stale_or_missing_records":{"$ref":"#/$defs/count"}}},"invariants":{"type":"object","additionalProperties":false,"required":["critical_gates","passing_critical_gates"],"properties":{"critical_gates":{"$ref":"#/$defs/count"},"passing_critical_gates":{"$ref":"#/$defs/count"}}},"generated_files":{"type":"object","additionalProperties":false,"required":["forecast_generated_outcomes","rewritten_generated_outcomes"],"properties":{"forecast_generated_outcomes":{"$ref":"#/$defs/count"},"rewritten_generated_outcomes":{"$ref":"#/$defs/count"}}},"replay_restarts":{"type":"object","additionalProperties":false,"required":["clean_runs","restart_events_status"],"properties":{"clean_runs":{"$ref":"#/$defs/count"},"restart_events_status":{"enum":["recorded","not-recorded"]}}},"report_usability":{"type":"object","additionalProperties":false,"required":["published_artifacts","independent_reproduction_status"],"properties":{"published_artifacts":{"$ref":"#/$defs/count"},"independent_reproduction_status":{"enum":["recorded","not-recorded"]}}},"fresh_vs_incremental":{"type":"object","additionalProperties":false,"required":["fresh_runs","incremental_differences","incremental_lineage_accepted"],"properties":{"fresh_runs":{"$ref":"#/$defs/count"},"incremental_differences":{"$ref":"#/$defs/count"},"incremental_lineage_accepted":{"type":"boolean"}}},"observation":{"type":"object","additionalProperties":false,"required":["category","status","owner","severity","action","acceptance_rationale"],"properties":{"category":{"enum":["automation","classification","manual-effort","provenance","invariants","generated-files","replay-restarts","report-usability","fresh-vs-incremental","platform-result"]},"status":{"enum":["resolved","action-required","accepted-limitation"]},"owner":{"type":"string","minLength":1},"severity":{"enum":["low","medium","high","critical"]},"action":{"type":"string","minLength":1},"acceptance_rationale":{"type":"string","minLength":1}}}}}
