{"digest":"sha256:4feb5da281348a54c9302350760170e194e9edbdea43613aecb8a52f00026be1","inputs":[{"digest":"sha256:8500d605991aea5e80df6614e7873c7def9d2796fce985b596eecc64d2f18dbf","role":"acceptance"},{"digest":"sha256:b12a19fff1bf2aae0d42926e83b8fe6f9c84b77ca7b92bec1bee0f3b9647ae1f","role":"fixture"},{"digest":"sha256:6e504e153f1f9f2df79f68265dc35057bb3e8b5465528879880283dd07b4a49e","role":"incremental"},{"digest":"sha256:1aeae5a69ad08767744833d1d3bf65e18f2761f2e6a64e229eca7f3a10ad0604","role":"proposal"},{"digest":"sha256:8db205dbce48c4d9f18648ea20a4610d3adeb5ee1ef6a2f9ede3923ad1fb23eb","role":"validation"}],"metrics":{"automation":{"automatic_outcomes":26,"basis_points":6500,"total_outcomes":40},"classification":{"false_clean_paths":[],"false_conflict_paths":["src/txrequest.cpp"]},"fresh_vs_incremental":{"fresh_runs":2,"incremental_differences":11,"incremental_lineage_accepted":false},"generated_files":{"forecast_generated_outcomes":6,"rewritten_generated_outcomes":6},"invariants":{"critical_gates":15,"passing_critical_gates":15},"manual_effort":{"eliminated_manual_boundaries":1,"forecast_manual_outcomes":6,"manual_outcomes":6},"provenance":{"locked_inputs":5,"stale_or_missing_records":0},"replay_restarts":{"clean_runs":2,"restart_events_status":"not-recorded"},"report_usability":{"independent_reproduction_status":"not-recorded","published_artifacts":3}},"observations":[{"acceptance_rationale":"all locked forecast paths are accounted","action":"retain complete forecast-to-outcome accounting","category":"automation","owner":"methodology","severity":"high","status":"resolved"},{"acceptance_rationale":"clean forecasts and conservative escalations are separately measurable","action":"require proof before a forecast manual boundary is absorbed","category":"classification","owner":"methodology","severity":"medium","status":"action-required"},{"acceptance_rationale":"manual effort remains bounded by outcome evidence","action":"record manual outcomes and eliminated boundaries","category":"manual-effort","owner":"methodology","severity":"medium","status":"resolved"},{"acceptance_rationale":"no stale or missing record is accepted","action":"retain digest-locked evidence inputs","category":"provenance","owner":"methodology","severity":"high","status":"resolved"},{"acceptance_rationale":"all recorded critical gates passed","action":"require all critical invariant gates","category":"invariants","owner":"safety","severity":"high","status":"resolved"},{"acceptance_rationale":"generated outcomes are separately recorded","action":"derive generated outputs after candidate construction","category":"generated-files","owner":"replay","severity":"medium","status":"resolved"},{"acceptance_rationale":"current evidence records clean runs but not restart events","action":"version explicit restart-event evidence","category":"replay-restarts","owner":"replay","severity":"medium","status":"action-required"},{"acceptance_rationale":"current evidence records artifacts but not usability observation","action":"record independent report-consumer reproduction","category":"report-usability","owner":"operations","severity":"medium","status":"action-required"},{"acceptance_rationale":"all observed differences are owned and incremental lineage is not accepted","action":"treat incremental history only as a classified diagnostic","category":"fresh-vs-incremental","owner":"methodology","severity":"high","status":"resolved"},{"acceptance_rationale":"inherited failures must not be called candidate success","action":"preserve lane-level classification separate from aggregate conclusion","category":"platform-result","owner":"operations","severity":"medium","status":"resolved"}],"outcomes":[{"actual":"automatic","forecast":"exact","path":".editorconfig"},{"actual":"manual","forecast":"manual","path":".github/actions/configure-docker/action.yml"},{"actual":"manual","forecast":"manual","path":".github/workflows/ci.yml"},{"actual":"automatic","forecast":"clean-textual","path":"CMakeLists.txt"},{"actual":"manual","forecast":"manual","path":"ci/README.md"},{"actual":"automatic","forecast":"clean-textual","path":"ci/test/00_setup_env_i686_multiprocess.sh"},{"actual":"automatic","forecast":"exact","path":"contrib/guix/INSTALL.md"},{"actual":"automatic","forecast":"exact","path":"contrib/tracing/README.md"},{"actual":"automatic","forecast":"exact","path":"depends/gen_id"},{"actual":"automatic","forecast":"clean-textual","path":"doc/build-freebsd.md"},{"actual":"automatic","forecast":"exact","path":"doc/build-netbsd.md"},{"actual":"automatic","forecast":"clean-textual","path":"doc/build-openbsd.md"},{"actual":"rewritten","forecast":"generated","path":"doc/man/bitcoin-cli.1"},{"actual":"rewritten","forecast":"generated","path":"doc/man/bitcoin-qt.1"},{"actual":"rewritten","forecast":"generated","path":"doc/man/bitcoin-tx.1"},{"actual":"rewritten","forecast":"generated","path":"doc/man/bitcoin-util.1"},{"actual":"rewritten","forecast":"generated","path":"doc/man/bitcoin-wallet.1"},{"actual":"rewritten","forecast":"generated","path":"doc/man/bitcoind.1"},{"actual":"automatic","forecast":"exact","path":"doc/release-notes.md"},{"actual":"manual","forecast":"snapshot-only","path":"src/clientversion.cpp"},{"actual":"absorbed","forecast":"absorbed","path":"src/common/netif.cpp"},{"actual":"automatic","forecast":"clean-textual","path":"src/dbwrapper.cpp"},{"actual":"automatic","forecast":"clean-textual","path":"src/dbwrapper.h"},{"actual":"automatic","forecast":"exact","path":"src/leveldb/db/autocompact_test.cc"},{"actual":"automatic","forecast":"exact","path":"src/leveldb/db/db_test.cc"},{"actual":"automatic","forecast":"exact","path":"src/leveldb/db/version_set.cc"},{"actual":"manual","forecast":"manual","path":"src/node/miner.h"},{"actual":"automatic","forecast":"exact","path":"src/test/coins_tests.cpp"},{"actual":"automatic","forecast":"exact","path":"src/test/fuzz/deserialize.cpp"},{"actual":"automatic","forecast":"clean-textual","path":"src/txdb.cpp"},{"actual":"automatic","forecast":"clean-textual","path":"src/txdb.h"},{"actual":"manual","forecast":"manual","path":"src/txmempool.h"},{"actual":"absorbed","forecast":"manual","path":"src/txrequest.cpp"},{"actual":"automatic","forecast":"clean-textual","path":"src/validation.cpp"},{"actual":"automatic","forecast":"exact","path":"src/wallet/CMakeLists.txt"},{"actual":"automatic","forecast":"clean-textual","path":"src/wallet/rpc/spend.cpp"},{"actual":"automatic","forecast":"clean-textual","path":"src/wallet/spend.cpp"},{"actual":"automatic","forecast":"exact","path":"src/wallet/test/fuzz/crypter.cpp"},{"actual":"automatic","forecast":"exact","path":"src/wallet/test/spend_tests.cpp"},{"actual":"automatic","forecast":"clean-textual","path":"test/lint/test_runner/src/main.rs"}],"schema_version":1,"transitions":[{"actual":"absorbed","forecast":"absorbed","paths":["src/common/netif.cpp"]},{"actual":"automatic","forecast":"clean-textual","paths":["CMakeLists.txt","ci/test/00_setup_env_i686_multiprocess.sh","doc/build-freebsd.md","doc/build-openbsd.md","src/dbwrapper.cpp","src/dbwrapper.h","src/txdb.cpp","src/txdb.h","src/validation.cpp","src/wallet/rpc/spend.cpp","src/wallet/spend.cpp","test/lint/test_runner/src/main.rs"]},{"actual":"automatic","forecast":"exact","paths":[".editorconfig","contrib/guix/INSTALL.md","contrib/tracing/README.md","depends/gen_id","doc/build-netbsd.md","doc/release-notes.md","src/leveldb/db/autocompact_test.cc","src/leveldb/db/db_test.cc","src/leveldb/db/version_set.cc","src/test/coins_tests.cpp","src/test/fuzz/deserialize.cpp","src/wallet/CMakeLists.txt","src/wallet/test/fuzz/crypter.cpp","src/wallet/test/spend_tests.cpp"]},{"actual":"rewritten","forecast":"generated","paths":["doc/man/bitcoin-cli.1","doc/man/bitcoin-qt.1","doc/man/bitcoin-tx.1","doc/man/bitcoin-util.1","doc/man/bitcoin-wallet.1","doc/man/bitcoind.1"]},{"actual":"absorbed","forecast":"manual","paths":["src/txrequest.cpp"]},{"actual":"manual","forecast":"manual","paths":[".github/actions/configure-docker/action.yml",".github/workflows/ci.yml","ci/README.md","src/node/miner.h","src/txmempool.h"]},{"actual":"manual","forecast":"snapshot-only","paths":["src/clientversion.cpp"]}]}
